"<|endoftext|>It has been shown that, when exposed to a single photon, the brain undergoes a process known as exciton evoked potentials (EEPs), which have been shown to be crucial in regulating neural excitability in a way similar to how the brain is able to regulate excitability via voltage changes to the cell body. However, the exact mechanisms of the EEGs remain unclear.

","<|endoftext|>It has been shown that the amount of blood flow to the brain is proportional to the amount of brain tissue that is covered (Figure 2). The volume of the blood flow in response to brain stimulation increases with the amount of brain tissue that remains exposed. Thus, the brain is a highly specialized organ and a highly diverse area with numerous subcellular compartments. Although the volume of space available for",neither,3,4,,neither,4,4,,neither,4,5,,,,,,,,,,,,,18_314_793
"<|endoftext|>Emphasised are the differences between the various forms of the term 'fetus'.

The distinction between the two forms is important, but there are differences as well. It should be kept in mind that the term 'fetal tissue' as used in the UK is not necessarily used in this context (although it has been for many years). Instead, when we mean a tissue within the",<|endoftext|>Emphasised are the benefits of the use of a non‐toxic solution for the removal of bacteria from surfaces. The use of this non‐toxic solution has been demonstrated to reduce the amount of bacteria on surfaces by over 50%. The use of a water based cleanser can have its advantages and disadvantages. The water used for the treatment of surfaces should be treated with an organic solvent and,neither,4,4,,neither,5,4,,neither,4,5,,,,,,,,,,,,,37_698_56
"<|endoftext|>Foundational to this is a basic understanding of the basic principles of the Universe: the fundamental laws that we know, the forces that we experience and the universe we live in.

In a universe that can be seen and feels, everything has motion and gravity. It is the same for our own body and the universe at large, but the laws of physics and space space have changed dramatically over","<|endoftext|>Foundational to this is the fact that in every single one of the cases above the person who is accused is not actually accused of any crime. Instead, the person who is accused has done nothing wrong, and in fact is simply being victimized by a corrupt government. In the case of this case, the accused is the owner and/or operator of a company whose products were found in over 30",A,3,3,,A,2,4,,neither,3,4,,,,,,,,,,,,,13_549_672
"<|endoftext|>Furthermore, as the report explains, the study shows that a high-quality and affordable public transportation system in India may be a key to achieving sustainable economic growth in India.

""The study shows India's population, infrastructure and urban infrastructure to be at a critical stage and this is where the government of India needs to invest, to take action and to deliver the right policies,"" the report stated","<|endoftext|>Furthermore, a study published in the Journal of Applied Physiology found that while the brain of a person with a severe form of epilepsy was able to control a motor vehicle, that of a person without a history of seizures was unable to operate one of them.
The U.S. government has a number of national and international space programs. SpaceX was founded in 1997 by Elon Musk, the",neither,3,3,,B,4,4,,B,4,4,,,,,,,,,,,,,55_178_263
"<|endoftext|>More importantly, we can make it easier on ourselves by making a commitment to our health in our day-to-day activities. In a world of ever-increasing complexity, it's important to make sure the people who work for us know that it's okay to take risks. It's also important for employers, who have to worry about the risk of injury or illness to their employees.
","<|endoftext|>More importantly, we can make it easier to create our own. We've added a new drop-down menu for each color of light, and a more flexible palette for the color wheel. The color wheel is a bit like a compass in the game world and is used for navigation of spaces, as well as a place to store resources that you need to keep safe from space debris and space time",neither,4,3,,B,4,4,,neither,4,3,,,,,,,,,,,,,9_740_655
"<|endoftext|>The key aspect discussed in this article is that of the 'sensitivity and specificity' of the effects of the various factors that affect the rate at which a person's brain generates neural connections with each other. The basic idea is that neural connections in space are the product of the space space of space, which is the space space, and the space space of space, which is the space space,","<|endoftext|>The key aspect discussed in this paper is to define the concept of 'good' (or 'worse' in a particular case), which is not just a question of which is better, but is also a question of what is worse and whether there are better alternatives. The problem of 'worse' is not simply a question of the quality of what is worse (or worse still). If",neither,2,3,,neither,1,4,,neither,1,3,,,,,,,,,,,,,24_285_324
"<|endoftext|>The central theme of this week's episode is a very important one:

We're all in this together!

The episode opens on a very different tone than last year (or maybe 2015). The central topic of the episode is the death of a child. It's a heartbreaking and heart-wrenching story with heartbreaking images of the aftermath and the pain and loss of children that","<|endoftext|>The central theme of this week's episode is the importance of the ""big picture."" The episode begins with the opening scenes of two major cities, and the first two episodes are a bit of a tour de force, a tour that weaves together a few different themes, each one in its own way. As one of the main characters travels through space to reach the moon, he meets up with",neither,3,2,,B,4,5,,B,3,3,,,,,,,,,,,,,0_614_335
"<|endoftext|>The issue focused on a series of incidents that occurred in the past three months, which included an alleged attempt by police to arrest a man who allegedly was involved in a fatal shooting in a suburban park last weekend.

A man was shot at the park in the 7200 block of North Broadway, about 1:30 a.m.; FOW-wing star-ring; N-space","<|endoftext|>The issue focused on a single piece: a white sheet of paper that appeared to have a hole for the hole. The team was able to extract DNA from that paper.

That's because the paper's shape and the hole it creates are different, the authors note. The holes also create an ""inertial bulge"" in space, a gravitational field which makes space-time curved",neither,3,2,,B,3,4,,neither,4,3,,,,,,,,,,,,,53_895_513
"<|endoftext|>Furthermore, as the report explains, the study shows that a high-quality and affordable public transportation system in India may be a key to achieving sustainable economic growth in India.

""The study shows India's population, infrastructure and urban infrastructure to be at a critical stage and this is where the government of India needs to invest, to take action and to deliver the right policies,"" the report stated","<|endoftext|>Furthermore, a study published in the Journal of Applied Physiology found that men are actually more likely to be able to perform simple tasks like pulling a chair, carrying a heavy load, and driving on a road with a heavy shoulder than females are.

""It is not clear, from our data, whether the effect is a result of differences in motor skill or motor coordination,"" says the study",neither,3,4,,neither,4,4,,neither,4,4,,,,,,,,,,,,,55_126_332
"<|endoftext|>Emphasised are the words of Jesus Christ. They were written in the New Testament. They are not the work of Satan.

The Bible tells us that Christ died on the cross, and that He ascended to heaven, but we know little of the details. He is also known to have been the first to die and was a man. He was the creator of the universe but the","<|endoftext|>Emphasised are the effects of exposure to the environmental stimuli on the development of the brain and the expression of the immune responses.

The findings provide evidence that environmental exposures are a critical link in the brain pathway of brain-immune interaction. These include:

the role of environmental factors in the development of the immune response

the role of stress in altering the response to infections.",neither,2,3,,neither,2,3,,neither,3,4,,,,,,,,,,,,,38_71_388
"<|endoftext|>This essay discusses a common misconception, and its implications for the development of the theory of evolutionary psychology. My focus is a specific example in psychology that deals with a particular form of evolutionary psychology (or the study of the human species). This is the ""cognitive psychology"" area which deals with the way the human mind processes cognitive information. This is a discipline that deals with how the brain processes complex","<|endoftext|>This essay discusses what a ""good"" job would look like, and why there is no one who could possibly do that. I hope you will agree with me about how important it is that everyone in your family gets a good career, and that the best of your parents' and grandparents' jobs were not to get into them.

In my own family, my father worked for a company",neither,4,4,,neither,4,4,,neither,4,4,,,,,,,,,,,,,23_628_806
"<|endoftext|>To conclude, we need to look at what the most popular types of books are. These are listed below, and are divided into the following categories: Fiction, Nonfiction, Graphic Novel, Art and Animation. In order of popularity we see a strong emphasis on fiction, but also a strong emphasis on graphic novels. It is important to remember that graphic novels do not fall into any categories of fiction","<|endoftext|>To conclude, we need to look at what the most powerful forces in our universe are doing to shape space-time and how they are changing our universe today. The Big Bang explosion of the universe was about 10 billion years ago. Since then, space-time has been expanding at the speed of light at about one billion miles per hour (1 AU/second). This is very slow and very",B,4,4,,B,5,5,,B,4,4,,,,,,,,,,,,,58_844_787
"<|endoftext|>In this essay, I discuss the importance of a well-designed, organized system of governance to promote transparency, equality and equity in the financial sector. While we can all agree it is a difficult task to achieve these goals with the existing infrastructure, it is not impossible. A large part of the space required for this space is being developed by the Space Space Foundation. It is our intention to provide","<|endoftext|>In this essay, I discuss the concept of the ""sensible universe,"" the theory of evolution that posits that life forms have evolved through a process of natural selection over billions of years of space. I argue that this process involves natural selection acting on a variety of space-time objects.

The space in space, space-time, space and space space. Space time space, space",neither,3,1,,B,2,1,,neither,3,4,,,,,,,,,,,,,33_767_645
"<|endoftext|>Furthermore, we are not talking about an actual ""game"" that will actually be played, but rather an actual ""game"" where players are allowed to create characters based on their personality traits (e.g., ""I hate to be called a loser"" or ""I am not a fan of this game""). This could be as small as the number of possible personality traits you can have on a","<|endoftext|>Furthermore, the fact that the study was published in the prestigious peer-reviewed journal, Proceedings of the National Academy of Sciences, is significant, and the paper was peer reviewed by several prominent researchers.

The paper, authored by a researcher from the University of Washington and published in the American Astronomical Society Space Telescope, also shows the dark side of the galaxy in space. The team has used",B,3,3,,B,3,5,,B,4,4,,,,,,,,,,,,,54_802_517
"<|endoftext|>Furthermore, we are not talking about an actual ""game"" that will actually be played, but rather an actual ""game"" where players are allowed to create characters based on their personality traits (e.g., ""I hate to be called a loser"" or ""I am not a fan of this game""). This could be as small as the number of possible personality traits you can have on a","<|endoftext|>Furthermore, we are not talking about an actual ""game"" that will actually be played, but rather an actual ""game"" where players are allowed to create characters based on their personality traits (e.g., ""I hate to be called a loser"" or ""I am not a fan of this game""). This could be as small as the number of possible personality traits you can have on a",neither,3,3,,neither,4,4,,neither,4,4,,,,,,,,,,,,,54_176_202
"<|endoftext|>Foundational to this is a very interesting question: Why is there a need to have a universal currency? It's not as if we don't have a lot of currencies in existence today, like the U.S. dollar, the Euro, the Japanese yen, or the Swiss franc. The reason is that most of these currencies are created by nations, and are designed to be a currency of","<|endoftext|>Foundational to this is a very interesting question: Why is there a need to have a universal currency? It's not as if we don't have a lot of currencies in existence today, like the U.S. dollar, the Euro, the Japanese yen, or the Swiss franc. The reason is that most of these currencies are created by nations, and are designed to be a currency of",neither,4,4,,neither,4,4,,neither,4,4,,,,,,,,,,,,,14_610_504
"<|endoftext|>Foundational to this is a basic understanding of the basic principles of the Universe: the fundamental laws that we know, the forces that we experience and the universe we live in.

In a universe that can be seen and feels, everything has motion and gravity. It is the same for our own body and the universe at large, but the laws of physics and space space have changed dramatically over","<|endoftext|>Foundational to this is the fact that in every single one of the worlds we've ever lived in we've had to deal with an alien force known as the ""Godhead"". These entities were responsible for all of space and time, creating everything in existence and even creating the sun and moon. This is why we have planets orbiting the sun, and why we exist in space. We're all",both,3,4,,both,2,4,,B,3,5,,,,,,,,,,,,,13_433_247
"<|endoftext|>Furthermore, a study published in the Journal of Applied Physiology found that while the brain of a person with a severe form of epilepsy was able to control a motor vehicle, that of a person without a history of seizures was unable to operate one of them.
The U.S. government has a number of national and international space programs. SpaceX was founded in 1997 by Elon Musk, the","<|endoftext|>Furthermore, a study published in the Journal of Applied Physiology found that men are actually more likely to be able to perform simple tasks like pulling a chair, carrying a heavy load, and driving on a road with a heavy shoulder than females are.

""It is not clear, from our data, whether the effect is a result of differences in motor skill or motor coordination,"" says the study",neither,3,4,,neither,4,4,,A,4,4,,,,,,,,,,,,,55_589_232
"<|endoftext|>Views on a woman who is a victim of sexual assault are often based on the assumption that she must be angry, sad, upset or depressed about what has happened, or else there must be other reasons for the attack to happen.

A man accused of beating his girlfriend's son and her two-year-old son to death in a backyard pool has been sentenced.

The","<|endoftext|>Views on a range of different issues have emerged in the wake of the publication of The Spectator newspaper. In a wide-ranging survey by Ipsos Mori, a poll conducted for The Spectator, almost one-quarter (23 per cent) of Britons believe that ""Britain should leave the European Union"" and almost six-in-ten (61 per cent) believe the UK should remain",neither,4,3,,neither,3,3,,neither,3,4,,,,,,,,,,,,,50_101_706
"<|endoftext|>Foundational to this is a theory called a ""supermax"" (see below). In a supermax, each of the most powerful supermassive black holes are packed with other very powerful supermassive black holes, but they are in opposite directions and are separated by a vast distance. This separation allows for the black hole to form from gas, but also for the gravitational force between the stars, stars","<|endoftext|>Foundational to this is a very powerful and powerful argument. There is a lot of talk around how to build a system that is truly decentralized and that is based on peer-to-peer networks.

The reason is that you can use a network to create new space and then you can then use the space to store resources. It's basically a way to space the game.


",both,2,2,,A,3,2,,A,2,3,,,,,,,,,,,,,14_597_131
"<|endoftext|>It has been shown that the effects of the stressor and the duration of the exposure have a critical period (the duration of time the organism must be in before it has any effect), but how can you know when the stressor has been eliminated?
The ""A"" word is not a letter and it does not have an ""i"" in its middle space, like in ""a space","<|endoftext|>It has been shown that, when exposed to a particular odor, the brain produces a variety of proteins that help regulate the chemical and chemical-induced immune responses and other functions of the body's cells. In the human brain, a protein called microglia, the principal component of the inflammatory network in the body, is also associated with the risk of cancer, suggesting that inflammation may play a role",neither,2,3,,neither,3,3,,neither,3,4,,,,,,,,,,,,,20_263_65
"<|endoftext|>More importantly, this is not an argument in favor of the idea of a national ID program, even though the federal government has done much, much more to encourage it than the federal government itself does.

The point of the argument is that the federal government's ability to provide universal public services to the American people and its willingness to provide them through federal programs is an important part of our democracy","<|endoftext|>More importantly, this is not an accident, it is a deliberate and calculated attempt on the part of Israel. The plan is for Israel, and the U.S., to invade the DPRK by land, sea, and air, as well as by space.
The space program includes a large and powerful space launch system called Orion (Orion Spacecraft) and the space station crew module (",neither,3,2,,B,4,3,,B,3,4,,,,,,,,,,,,,10_108_743
"<|endoftext|>Emphasised are:

1. An explanation of the principles that underlie the creation, operation, and use of the Universe as the Universe is.

2. The history of the Universe, in order to understand why we observe our Universe as it is.

3. A description of the Universe, the fundamental building blocks of matter, energy and space that compose our Universe","<|endoftext|>Emphasised are the differences between the various forms of the term 'fetus'.

The distinction between the two forms is important, but there are differences as well. It should be kept in mind that the term 'fetal tissue' as used in the UK is not necessarily used in this context (although it has been for many years). Instead, when we mean a tissue within the",A,2,4,,A,4,5,,neither,3,4,,,,,,,,,,,,,37_405_430
"<|endoftext|>To summarise, a new analysis of the UK's carbon emissions by the European Commission finds that the UK's carbon emissions are still growing despite a fall in the overall rate of emissions. In fact, the UK is now more carbon intensive than the average for all EU countries (see figure 1).

Figure 1

Source: European Commission, EIA, and the ERC/ES","<|endoftext|>To summarise, it was an interesting experience and the first time I had seen this game from the developer itself, I'm happy to say that this one looks really good.


I was really surprised by this game's visuals. There are some pretty cool looking enemies, but they were all quite simple compared to the rest of the game. The environments are pretty good with a bit more variety",neither,4,4,,neither,4,4,,neither,4,4,,,,,,,,,,,,,8_816_614
"<|endoftext|>This essay discusses a series of cases that demonstrate that the U.S. Constitution is not, in fact, a document of limited constitutional authority. In some of these cases, the U.S. has a clear interest in preserving its sovereignty over space; in other words, the U.S. is the space power, and the space power is the space power. Space exploration is not a","<|endoftext|>This essay discusses the relationship between the development of a new species and the formation of a species-typology, the theory that different types of organisms can evolve from one another by mutual exchange. In other words, there are evolutionary relationships among species and between individuals. The term ""species-typology"" derives from the Greek word ""skottos"", which describes a type of organism or group of",neither,2,4,,A,3,3,,A,3,4,,,,,,,,,,,,,22_385_166
"<|endoftext|>Views on a recent survey of more than 3,000 Canadians showed that nearly three out of four (68.5 per cent) people support the idea of an interplanetary space station. In the last few years, NASA has begun developing plans for the future of our space program, and has been looking at the possible space station as a vehicle to explore space. Space shuttle space shuttle is","<|endoftext|>Views on the subject of religion and morality are divided along two different axes of opinion. On one hand, there are those who believe that a person is only morally obligated to do what is right in this world, and that there is nothing wrong in being religious or religious people are only morally obligated to do right actions, as well. These views are held by some liberals and conservatives in America and",A,4,2,,A,4,3,,A,4,3,,,,,,,,,,,,,49_221_86
"<|endoftext|>To review, I've been reading the books of Thomas Hobbes, William Morris, and James Joyce, and I'm really enjoying them.

Hobbes was born a poor boy in 1807 to a family of farmers. Hobbes, a child who was born blind, had never been in school before, and it was difficult for him to learn to read and write. After being","<|endoftext|>To review, in this review we will focus on two aspects:

How do I make my own custom mousepad? How do I get a new one? How do I make it look good?

I've used a mousepad a few times since I moved back to New Orleans, and they always have a place that fits my small space. I always keep an eye out for",neither,4,2,,neither,4,3,,neither,4,4,,,,,,,,,,,,,5_580_759
"<|endoftext|>The central theme to this article is that there's no way we know what will happen when a super-intelligent alien race arrives on Earth. It's a theme that's been a theme in science fiction, but it's never made sense before: why would the humans of the solar system, our planet-sized home, have a space race with a planet as small as Pluto? It's","<|endoftext|>The central theme to this article is that there's no way we could have survived as long, or with the same amount of freedom as we did without the use of the Internet.

The Internet, in my mind, started out simply because there were no other ways to get information, and because the information was so free.

It started with the invention of radio broadcasting in the 19",A,3,3,,A,3,4,,A,3,3,,,,,,,,,,,,,1_339_156
"<|endoftext|>The issue focused on a series of incidents that occurred in the past three months, which included an alleged attempt by police to arrest a man who allegedly was involved in a fatal shooting in a suburban park last weekend.

A man was shot at the park in the 7200 block of North Broadway, about 1:30 a.m.; FOW-wing star-ring; N-space","<|endoftext|>The issue focused on a series of incidents that occurred in the past three months, when two young men in Northampton, Mass., were arrested after a video of a naked man being forced onto a sidewalk surfaced on the Internet.

The arrest of the two men, who were charged with disorderly conduct, is the focus of a lawsuit filed against the city by two people who were involved in that",neither,3,2,,neither,3,4,,neither,3,4,,,,,,,,,,,,,53_111_416
"<|endoftext|>Views on a recent survey of more than 3,000 Canadians showed that nearly three out of four (68.5 per cent) people support the idea of an interplanetary space station. In the last few years, NASA has begun developing plans for the future of our space program, and has been looking at the possible space station as a vehicle to explore space. Space shuttle space shuttle is","<|endoftext|>Views on the issue are mixed. The American Civil Liberties Union said it ""strongly disagrees"" with the decision and will file a formal legal challenge.

On Thursday the Supreme Court will hear arguments from the Obama administration regarding whether the NSA can access phone call data from overseas.

It's the biggest surveillance case since the 9/11 terrorist attacks that left nearly 3,000 dead",A,4,4,,A,5,5,,A,5,4,,,,,,,,,,,,,48_851_309
"<|endoftext|>This essay discusses what a ""good"" job would look like, and why there is no one who could possibly do that. I hope you will agree with me about how important it is that everyone in your family gets a good career, and that the best of your parents' and grandparents' jobs were not to get into them.

In my own family, my father worked for a company","<|endoftext|>This essay discusses what a ""normal"" life should be like, and why people are willing to live it in such a way. We discuss the benefits and drawbacks of various kinds of homes and apartments, as well as the different styles of living in a space, like an office or house.

The idea is that there's more to space than the wall of glass. You can have space",neither,4,2,,neither,4,4,,neither,4,4,,,,,,,,,,,,,22_816_523
