"<|endoftext|>This essay discusses a common misconception, and its implications for the development of the theory of evolutionary psychology. My focus is a specific example in psychology that deals with a particular form of evolutionary psychology (or the study of the human species). This is the ""cognitive psychology"" area which deals with the way the human mind processes cognitive information. This is a discipline that deals with how the brain processes complex","<|endoftext|>This essay discusses a common misconception, and its implications for the study of the relationship between religion and politics (i.e. the religious dimension). It also provides a new approach for understanding religious identity.

A. Introduction

A number of the fundamental principles of physics apply in space. A point of light has mass, and space is a curved space with two axes, which are spac",neither,4,3,,neither,4,3,,neither,4,4,,,,,,,,,,,,,23_872_845
"<|endoftext|>To review, this is a story about my mother. She is a wonderful mother, but I can't bring myself to read this article without her presence in my brain for at least five minutes before the page ends and I have no reason to think the words I'm writing are going to make any difference.

She has been my life for over two decades. She's my love, my","<|endoftext|>To review, I've been working on a new book project, and this year, we will have some exciting news to report about it!

This year we are launching the book, ""I Am the Sun"", as a monthly series. In the first month we will cover the solar systems of Earth, Mars, Venus and Jupiter, as well as a host of smaller planets and moons orbiting",neither,3,3,,B,4,5,,neither,3,4,,,,,,,,,,,,,4_890_27
"<|endoftext|>This essay discusses a common misconception, and its implications for the study of the relationship between religion and politics (i.e. the religious dimension). It also provides a new approach for understanding religious identity.

A. Introduction

A number of the fundamental principles of physics apply in space. A point of light has mass, and space is a curved space with two axes, which are spac","<|endoftext|>This essay discusses a common misconception, and its implications for the development of the theory of evolutionary psychology. My focus is a specific example in psychology that deals with a particular form of evolutionary psychology (or the study of the human species). This is the ""cognitive psychology"" area which deals with the way the human mind processes cognitive information. This is a discipline that deals with how the brain processes complex",neither,3,4,,neither,3,4,,neither,4,4,,,,,,,,,,,,,23_187_520
"<|endoftext|>Views on a woman who is a victim of sexual assault are often based on the assumption that she must be angry, sad, upset or depressed about what has happened, or else there must be other reasons for the attack to happen.

A man accused of beating his girlfriend's son and her two-year-old son to death in a backyard pool has been sentenced.

The","<|endoftext|>Views on the role of religion in education: a review of research, policy and practice

By Simon Tisdall, Professor in the Department of Social Sciences of the University of Exeter


I have been a practising Catholic since I was 15. I have always been fascinated with the question of how and where religion influences education. I believe this is a subject on which much research",neither,4,3,,neither,3,4,,neither,4,3,,,,,,,,,,,,,50_229_248
"<|endoftext|>In summary, it seems that the majority of people in Japan have an unfavorable view of the US, and a strong anti-Japan sentiment is growing.

The country's most popular TV shows, from ""The Legend of Korra"", are getting more popular.

A report of a Japanese company's TV ad, which is now being dubbed the most watched ever by television viewers in a single","<|endoftext|>In summary, we found that when using a different approach that does not involve a reference to external libraries, the performance impact is about as large as using the full system as well.

We used the following techniques for our benchmarks:

The following table shows the performance of the Intel® Xeon Phi™ processor on the Intel® Skylake platform with the Skylake memory subsystem. The performance",neither,2,3,,neither,3,4,,neither,3,4,,,,,,,,,,,,,43_557_651
"<|endoftext|>The connection between the American economy and the world is at stake in this year's election. We will see if our leaders have the guts to make a serious choice between freedom and stability and the security of our planet.

As a citizen of the planet, I want to know what the planet can do if humans are allowed to use space. Space is space. Space is space! And space","<|endoftext|>The connection between the United States and Russia is the greatest military power on earth, yet it remains unclear if the United States can use its influence and leverage to improve relations with Moscow.

In his address on Tuesday night, Secretary of State Rex Tillerson said that the United States was ""looking forward to continuing to build and strengthen relations with Russia,"" and added that ""our commitment is not just to",neither,2,4,,A,1,4,,neither,2,4,,,,,,,,,,,,,27_577_284
"<|endoftext|>To summarise, we have a situation where the majority of the world's population is under threat to extinction, and there seems to be no end in sight to the global catastrophe.

The most obvious response might be to do something about it.

But the answer is more complicated, and we may be in for a long, long time before we have anything to do about climate change","<|endoftext|>To summarise, a lot of the information here is true, some is just speculation. But, for the first time in a while we have some idea of the size of the universe, and it does not look like it's shrinking in size at all.

The space of space, the universe, is expanding, the universe, is expanding

This space is expanding space and space",B,5,2,,B,4,2,,both,3,3,,,,,,,,,,,,,7_866_465
"<|endoftext|>Prior to this week's meeting, I was in the midst of a lengthy discussion on why the NFL doesn't want to be associated with a team that has been linked to multiple sexual harassment claims.

I had my reasons, but I still didn't have a definitive answer to the question of why the league would want to avoid the issue of sexual harassment, given that it has been an ongoing","<|endoftext|>Prior to this week's episode, we talked to the producers and cast about how the episode will unfold as the show moves forward.

What can readers expect from the upcoming episodes?

In terms of how you expect to watch it, we're going to be doing what we did this past weekend – we're going to have some really intense, intense action with a lot of blood and",neither,4,2,,neither,3,3,,neither,4,3,,,,,,,,,,,,,47_556_142
"<|endoftext|>To review, a group or a class is defined as a group or a class. An organization (such as the U.S., Russia, etc.) is an individual with rights. An organization is the individual that the organization represents and is responsible to. There are many types and sizes of organizations, and the number is limitless.

I was wondering if people were aware of what it takes","<|endoftext|>To review, I've been reading the books of Thomas Hobbes, William Morris, and James Joyce, and I'm really enjoying them.

Hobbes was born a poor boy in 1807 to a family of farmers. Hobbes, a child who was born blind, had never been in school before, and it was difficult for him to learn to read and write. After being",neither,2,4,,neither,3,4,,neither,4,4,,,,,,,,,,,,,5_57_844
"<|endoftext|>Views on a recent survey of more than 2,000 Canadians showed that nearly three in 4 people (29 per cent) felt there was no reason to be afraid of the Islamic State.

A second poll of 2,079 respondents conducted by Nanos Research, a market research company, also released Tuesday, had another result: that nearly one in five people felt Canada could do a","<|endoftext|>Views on the issue are mixed. The American Civil Liberties Union said it ""strongly disagrees"" with the decision and will file a formal legal challenge.

On Thursday the Supreme Court will hear arguments from the Obama administration regarding whether the NSA can access phone call data from overseas.

It's the biggest surveillance case since the 9/11 terrorist attacks that left nearly 3,000 dead",neither,3,4,,neither,4,5,,neither,4,4,,,,,,,,,,,,,48_278_605
"<|endoftext|>The issue focused on the government's decision to allow a small minority to use public housing. It was part of an effort to ""improve conditions"" in the units. The group called for ""a full and thorough review of all housing in our country's public housing, to determine if there is anything else that could be done to help improve conditions in these units.""

The group also asked to","<|endoftext|>The issue focused on a single piece: a white sheet of paper that appeared to have a hole for the hole. The team was able to extract DNA from that paper.

That's because the paper's shape and the hole it creates are different, the authors note. The holes also create an ""inertial bulge"" in space, a gravitational field which makes space-time curved",neither,4,2,,B,5,4,,neither,5,3,,,,,,,,,,,,,51_90_451
"<|endoftext|>The issue focused on the way that the company has been able to generate revenue while also maintaining a healthy balance sheet.

The company's shares are up 2.5 percent today as investors remain focused on the stock's growth potential despite recent market turbulence.

A new study published in the American Economic Association's Economic Papers, shows that a large number of people living in urban areas have a","<|endoftext|>The issue focused on a single piece: a white sheet of paper that appeared to have a hole for the hole. The team was able to extract DNA from that paper.

That's because the paper's shape and the hole it creates are different, the authors note. The holes also create an ""inertial bulge"" in space, a gravitational field which makes space-time curved",neither,4,2,,B,5,4,,both,4,3,,,,,,,,,,,,,51_549_451
"<|endoftext|>The connection between the human body and the environment is one of the biggest threats to biodiversity. Our bodies are the largest living organisms in the universe. Their vast number and complexity makes it a wonder that they were ever created at all; their creation was the result of a divine intervention.
In this universe the planet Earth is a planet made of rocks, ice, water, sand and earth. It","<|endoftext|>The connection between the American economy and the world is at stake in this year's election. We will see if our leaders have the guts to make a serious choice between freedom and stability and the security of our planet.

As a citizen of the planet, I want to know what the planet can do if humans are allowed to use space. Space is space. Space is space! And space",neither,4,2,,both,5,2,,both,4,2,,,,,,,,,,,,,27_139_253
"<|endoftext|>The key aspect discussed by the author regarding the role of social media in the current political climate is the lack of a coherent narrative in the media. As noted before, there has been a huge amount of attention paid toward the issue of climate change and how the world's energy resources are managed in a globalised world, and there are many other issues of global importance. Yet, the space space in","<|endoftext|>The key aspect discussed by the court today as to whether or not a person is subject to the law is that a court cannot consider a person's mental capacity as the sole criterion for making an order. In other words, the law cannot be applied with a view to the mental capacity of an individual.

""A court cannot consider, in the absence of the totality of the circumstances surrounding a",neither,3,2,,neither,3,4,,neither,5,4,,,,,,,,,,,,,25_299_608
"<|endoftext|>Foundational to this is that the first generation of women were born as a result of the sexual revolution, so to have them live in a society that values sexuality as the basis for their life is a very difficult concept indeed.

As the book notes, the idea of sex is still considered a taboo in our world, which has led the way to an increased number of men and women engaging","<|endoftext|>Foundational to this is the fact that in every single one of the worlds we've ever lived in we've had to deal with an alien force known as the ""Godhead"". These entities were responsible for all of space and time, creating everything in existence and even creating the sun and moon. This is why we have planets orbiting the sun, and why we exist in space. We're all",B,4,4,,B,4,4,,B,4,5,,,,,,,,,,,,,12_270_461
"<|endoftext|>The key aspect discussed in this chapter, in terms of the role of government, is the central role it plays in promoting a society in which individuals can pursue their own interests, and where the rule of law is respected, in accordance with their own moral and social commitments. A society based on such principles, in the view of those who favor such a system as a viable alternative to a totalitarian state","<|endoftext|>The key aspect discussed in this chapter, in terms of the role of human capital in the evolution of global economies, is a key question for economists and policymakers in the future, as global trade flows become more complex and the need for global infrastructure becomes ever-more urgent.

To address this problem, a new type of nanotube material, a graphene-based nanoelectronic material",neither,3,3,,neither,4,5,,neither,4,4,,,,,,,,,,,,,26_848_611
"<|endoftext|>To conclude, a large majority of those surveyed did not want their children to attend public schools, and a large number (80%) wanted their children to go to private schools. The most common response was a strong desire to continue teaching at schools outside their community.

A small minority, 2%, of those surveyed said that they were not interested in going to private schools but instead wanted their child","<|endoftext|>To conclude, the results indicate a possible connection between the development of cognitive ability and the evolution of language acquisition, which, in turn, might explain why language is more important in humans than other animals. The results are in keeping with recent evidence from a number of animal studies (reviewed by Gagnon, 2008; Kandel, 2008).

Acknowledgments We thank Dr. Robert Gagn",neither,3,3,,neither,4,3,,neither,3,4,,,,,,,,,,,,,59_564_574
"<|endoftext|>The issue focused on how a new federal program could allow for more than one employer in a single state. The legislation would also allow for employers with more than 50 employees in another state to apply for waivers, which would permit them to hire from the same state for a period of at least three years.


A federal judge ruled on Friday to block the law from taking effect.


""","<|endoftext|>The issue focused on a single issue, but there are several that affect our lives that are worth looking at.

The first issue concerns the relationship between the two types of data:

The data

The data is data: objects or collections of objects.

The data

The data is data.

The data

The data is data

The data",neither,3,2,,neither,4,1,,neither,3,1,,,,,,,,,,,,,52_546_425
"<|endoftext|>The issue focused on a single piece: a white sheet of paper that appeared to have a hole for the hole. The team was able to extract DNA from that paper.

That's because the paper's shape and the hole it creates are different, the authors note. The holes also create an ""inertial bulge"" in space, a gravitational field which makes space-time curved","<|endoftext|>The issue focused on a series of incidents that occurred in the past three months, when two young men in Northampton, Mass., were arrested after a video of a naked man being forced onto a sidewalk surfaced on the Internet.

The arrest of the two men, who were charged with disorderly conduct, is the focus of a lawsuit filed against the city by two people who were involved in that",neither,2,2,,A,4,4,,A,3,4,,,,,,,,,,,,,53_577_112
"<|endoftext|>In this essay, I argue that the rise of social media platforms like Twitter is the primary reason for the recent increase in the global poverty rate. The article, which is co-written with Dr. John S. Della Vedova , professor emeritus of geosciences at the University of California, Berkeley, and former U.S. space shuttle astronaut, discusses space weather and the","<|endoftext|>In this essay I am going to explain what exactly ""theory"" in this context means, so that it might serve as a useful reference point when discussing the meaning and application of this particular word. The essay is intended to provide a brief overview of the meaning of ""theory"", a term that is also used for an explanation, a theory.

Definition

The definition of """,neither,3,3,,A,4,3,,A,4,3,,,,,,,,,,,,,34_9_654
"<|endoftext|>In summary, it seems that the majority of our current crop of software engineers are either ""just not as good as the experts"", or have been ""bought for the money"" (or perhaps the ""money"" is simply not worth doing anything else).

I would like to point out a few common ways to improve the quality of software development in general. These tips will help the average","<|endoftext|>In summary, a recent study found that a combination of the two most common antidepressants—prozac and zolpidem—were the most effective for treating severe depression when used together.

Zolpidem is a selective serotonin reuptake inhibitor that works by reducing the release of serotonergic neurotransmitters and increasing serotonin levels. The drugs, which are sold as Prozac and",neither,3,4,,neither,3,4,,neither,4,4,,,,,,,,,,,,,44_694_84
"<|endoftext|>The issue focused on a series of incidents that occurred in the past three months, which included an alleged attempt by police to arrest a man who allegedly was involved in a fatal shooting in a suburban park last weekend.

A man was shot at the park in the 7200 block of North Broadway, about 1:30 a.m.; FOW-wing star-ring; N-space","<|endoftext|>The issue focused on a series of incidents that occurred in the past three months, when two young men in Northampton, Mass., were arrested after a video of a naked man being forced onto a sidewalk surfaced on the Internet.

The arrest of the two men, who were charged with disorderly conduct, is the focus of a lawsuit filed against the city by two people who were involved in that",neither,3,2,,neither,3,4,,neither,3,4,,,,,,,,,,,,,53_623_482
"<|endoftext|>The central theme to this article is that there's no way we know what will happen when a super-intelligent alien race arrives on Earth. It's a theme that's been a theme in science fiction, but it's never made sense before: why would the humans of the solar system, our planet-sized home, have a space race with a planet as small as Pluto? It's","<|endoftext|>The central theme of this essay, as with many of the posts that have appeared in my blog over recent years, is to ask whether there are ways in which the ""new politics"" can be made to work.

This essay is about a new politics that is based upon an understanding of the ""old politics"", namely, the politics of the Left. This politics has, as my colleague",A,3,2,,A,3,5,,A,4,3,,,,,,,,,,,,,1_189_758
"<|endoftext|>An illustration of a solar flare, which occurred during a rare solar flare in July, shows the planet Neptune. It is the most distant planet from Earth and the sun, and Neptune is thought to be the sun's ""center of gravity."" This is a composite image of four photographs taken by NASA's New Horizons spacecraft that captured the event on Oct. 14, 2014. Credit: NASA/J","<|endoftext|>An illustration of an inter-dimensional portal is shown in this handout illustration provided on October 15, 2013 by NASA, which shows scientists exploring a wormhole at high velocity that could open up space, or space station, to interstellar space. (AP Photo/NASA, file)

The universe is big. And big it is, but not that big. It's big but the universe",both,3,2,,both,5,3,,both,4,3,,,,,,,,,,,,,30_130_751
"<|endoftext|>It has been shown that a significant amount of water can be lost in the human body from sweat and body hair (see: How much water does water?).

However, when a substance is dissolved into water, it is not just a liquid. It is a gas, and as we discussed a while back, the idea of gas spaces is not new (space-time-space,","<|endoftext|>It has been shown that a significant amount of human DNA in the human genome (1-5%, with a maximum estimated to be about 2%) may be passed on to offspring (6) via the paternal germline, but the exact extent to which this process can affect the outcome of offspring is poorly defined. A number of studies are underway investigating this issue, including studies of the effects of maternal",neither,2,3,,neither,3,4,,neither,2,3,,,,,,,,,,,,,19_879_318
"<|endoftext|>The relationship of the sun, its magnetic force, and its planets and moons. It's all connected, from the sun to Jupiter's moon Europa to the moon of Mars and all over the solar system.

How does our sun affect the Earth moon?

Solar radiation from the sun, as well as radiation from the moon, is absorbed by Earth's moon, moon orbit moon orbit","<|endoftext|>The relationship of the human mind to language is one of great mystery. How do people know what to do, what to say and what to think?

The human mind, as I understand it, is a complex collection of interconnected neural circuits that control the entire human body.

There is the brain, a complex, self-contained, living space. There are other spaces, but",neither,3,3,,A,4,4,,A,4,4,,,,,,,,,,,,,17_521_151
"<|endoftext|>The connection between the two sides of the debate over gay marriage, which began with the Supreme Court's ruling on marriage equality on June 26, is a little complicated to define, but it's clear that there is a significant divide in views about the best way forward.


The debate over same-sex couples' access to marriage equality has been framed by some conservative Christians as the moral equivalent of","<|endoftext|>The connection between a man's sexual orientation and his mental health is complicated by a lack of research on sexual orientation in the general population; the vast majority of researchers studying mental health believe it exists, but no evidence has been forthcoming.
The U.N. climate-change conference in Paris will be a major turning point in the world's relationship to space. It will mark the first time a",neither,3,2,,neither,4,4,,neither,4,3,,,,,,,,,,,,,29_338_763
"<|endoftext|>The connection between the United States and Russia is the greatest military power on earth, yet it remains unclear if the United States can use its influence and leverage to improve relations with Moscow.

In his address on Tuesday night, Secretary of State Rex Tillerson said that the United States was ""looking forward to continuing to build and strengthen relations with Russia,"" and added that ""our commitment is not just to","<|endoftext|>The connection between the United States and Russia is the greatest military power on earth, yet it remains unclear if the United States can use its influence and leverage to improve relations with Moscow.

In his address on Tuesday night, Secretary of State Rex Tillerson said that the United States was ""looking forward to continuing to build and strengthen relations with Russia,"" and added that ""our commitment is not just to",neither,4,4,,neither,4,4,,neither,4,4,,,,,,,,,,,,,27_764_630
"<|endoftext|>Views on a recent survey of more than 2,000 Canadians showed that nearly three in 4 people (29 per cent) felt there was no reason to be afraid of the Islamic State.

A second poll of 2,079 respondents conducted by Nanos Research, a market research company, also released Tuesday, had another result: that nearly one in five people felt Canada could do a","<|endoftext|>Views on a recent survey of more than 3,000 Canadians showed that nearly three out of four (68.5 per cent) people support the idea of an interplanetary space station. In the last few years, NASA has begun developing plans for the future of our space program, and has been looking at the possible space station as a vehicle to explore space. Space shuttle space shuttle is",B,3,4,,B,4,4,,B,3,4,,,,,,,,,,,,,48_156_495
"<|endoftext|>The connection between the two sides of the debate over gay marriage, which began with the Supreme Court's ruling on marriage equality on June 26, is a little complicated to define, but it's clear that there is a significant divide in views about the best way forward.


The debate over same-sex couples' access to marriage equality has been framed by some conservative Christians as the moral equivalent of","<|endoftext|>The connection to the internet and the internet is one of many factors that shape the nature, content, and use of the internet as a medium of exchange, access, and communication, and that includes a lot of different things like space exploration and science fiction.

I have been a big fan of Star Trek and the original series for over thirty years and have been fascinated by space exploration, space",B,3,3,,B,3,3,,B,4,3,,,,,,,,,,,,,28_624_573
