"<|endoftext|>It has been shown that, if we are to believe the findings of several studies, there is no need to have a ""space-time continuum"" as we know it. The reality is, as we see, the universe is actually infinite with infinite dimensions and space.

The space-time continuum is a concept from the concept of the universe. We are able to move space space space","<|endoftext|>It has been shown that a significant amount of human DNA in the human genome (1-5%, with a maximum estimated to be about 2%) may be passed on to offspring (6) via the paternal germline, but the exact extent to which this process can affect the outcome of offspring is poorly defined. A number of studies are underway investigating this issue, including studies of the effects of maternal",A,2,3,,A,5,3,,A,2,3,,,,,,,,,,,,,19_641_842
"<|endoftext|>Furthermore, we are not sure how well this will affect the future growth prospects. We are not aware of any other large country such as the USA which has such strong economy and population growth rates, but we expect that the USA is the most important space-based planet, and it is in space.

We will have an interplanetary space station. We will build the first space station","<|endoftext|>Furthermore, we are not talking about an actual ""game"" that will actually be played, but rather an actual ""game"" where players are allowed to create characters based on their personality traits (e.g., ""I hate to be called a loser"" or ""I am not a fan of this game""). This could be as small as the number of possible personality traits you can have on a",A,2,3,,A,4,4,,A,4,4,,,,,,,,,,,,,54_231_162
"<|endoftext|>To conclude, we need to look at what the most powerful forces in our universe are doing to shape space-time and how they are changing our universe today. The Big Bang explosion of the universe was about 10 billion years ago. Since then, space-time has been expanding at the speed of light at about one billion miles per hour (1 AU/second). This is very slow and very","<|endoftext|>To conclude, a large majority of people believe that their government should do more to protect its people in the event of an attack by terrorists. This is the first time in the history of the world that a group of people have gathered together around one goal to create a better world. The first time we were all together, the earth, and all space, was our home planet earth. We are",A,4,3,,A,4,4,,both,4,4,,,,,,,,,,,,,58_383_321
"<|endoftext|>The connection to the universe, the universe itself, and all things in it, are what makes everything. We are not the universe itself; all things in the universe are interconnected. All things in the universe are a collection of galaxies, stars, and universes. The universe exists as a collection of things, and everything exists in the universe.

The Universe is composed of everything that exists in","<|endoftext|>The connection between a man's sexual orientation and his capacity to have sexual intercourse in his body is often debated.

In recent weeks, several gay rights advocates have argued that gay men should be allowed to marry.

The American Medical Association has said it believes the health benefits of same-sex marriage outweigh the risks.

But there is still some controversy about whether same-sex sexual",A,2,3,,A,4,4,,A,3,3,,,,,,,,,,,,,29_377_484
"<|endoftext|>The central theme to the debate on how best to regulate the use of marijuana and hemp has been that of the role of law enforcement in the process.

The debate began in earnest in the early 2000s, when the Obama administration, which was still debating the legalization of drugs, began to look into the potential effects of marijuana on crime.

In a report, then-Justice Department","<|endoftext|>The central theme of the new film ""The Master"" (a.k.a. ""The Master"") is the idea that God created the universe with his mind at his disposal and his creative will to create things of his choosing.

""This is not some kind of science fiction film,"" said the director of ""The Master"" and ""The Amazing Spider-Man 3.""

",B,2,3,,B,4,3,,neither,4,3,,,,,,,,,,,,,2_306_672
"<|endoftext|>This essay discusses what a ""good"" job would look like, and why there is no one who could possibly do that. I hope you will agree with me about how important it is that everyone in your family gets a good career, and that the best of your parents' and grandparents' jobs were not to get into them.

In my own family, my father worked for a company","<|endoftext|>This essay discusses a common misconception, and its implications for the study of the relationship between religion and politics (i.e. the religious dimension). It also provides a new approach for understanding religious identity.

A. Introduction

A number of the fundamental principles of physics apply in space. A point of light has mass, and space is a curved space with two axes, which are spac",neither,4,3,,B,4,3,,B,4,2,,,,,,,,,,,,,23_486_33
"<|endoftext|>The central theme of this week's episode is a very important one:

We're all in this together!

The episode opens on a very different tone than last year (or maybe 2015). The central topic of the episode is the death of a child. It's a heartbreaking and heart-wrenching story with heartbreaking images of the aftermath and the pain and loss of children that","<|endoftext|>The central theme of this book is that we are living in a ""postmodern age"" that has made us increasingly intolerant of ideas that we do not like. As one of the book's main themes, the ""postmodern"" notion that the ""postmodern"" concept is the result of a ""modern intellectual"" is a myth perpetuated by people who have become obsessed with this concept in",neither,3,3,,neither,4,4,,neither,4,4,,,,,,,,,,,,,0_70_332
"<|endoftext|>The relationship of the human mind to language is well-documented. In particular, research in the last 20 years has shown that language is highly dependent on a particular set of mental states. In particular, the mind is highly correlated with linguistic abilities (the ability to understand, use, and use language) and with the level of the brain's processing of language (the capacity for processing language) as","<|endoftext|>The relationship of the brain-to-machine interface and virtual reality is well-documented. But researchers at MIT, who are developing brain-computer interfaces, have been working with a computer that's more than a year away from commercialization.

MIT researchers have developed computer hardware that can be used to control virtual environments, from virtual reality, using the brain. And, they've developed software",neither,3,3,,neither,2,4,,neither,4,3,,,,,,,,,,,,,17_844_578
"<|endoftext|>Prior to this year, we had only ever seen the first teaser trailer for the movie, which has now been released by Warner Bros. Pictures, and the film was officially unveiled by producer Judd Apatow at the Toronto International Film Festival. Now, the movie is set to hit theaters on May 23rd, 2013 and the trailer can be seen below:

The plot for the new movie","<|endoftext|>Prior to this, the company was known only for producing the first two of the iconic cars: the Ford Thunderbird and the Chevy Nova, and the first Ford Falcon to compete in an international series.

The company was formed as a joint venture between Ford and GM in the early 1960s, when the latter began working on the Saturn V space space rocket, a program that would eventually land",B,3,3,,B,5,2,,B,4,3,,,,,,,,,,,,,45_714_199
"<|endoftext|>Prior to this, the company was known by the initials of the name of the founder and chief executive officers, who are also listed as the company's cofounders. However, as of the time of this writing, the company has not yet made any statements or publicly announced that the name of the founding cofounders has changed.<|endoftext|>A man is dead and a man is in critical condition","<|endoftext|>Prior to this year, we had only ever seen the first teaser trailer for the movie, which has now been released by Warner Bros. Pictures, and the film was officially unveiled by producer Judd Apatow at the Toronto International Film Festival. Now, the movie is set to hit theaters on May 23rd, 2013 and the trailer can be seen below:

The plot for the new movie",neither,3,3,,neither,4,3,,neither,4,4,,,,,,,,,,,,,45_264_730
"<|endoftext|>Foundational to this is the fact that in every single one of the worlds we've ever lived in we've had to deal with an alien force known as the ""Godhead"". These entities were responsible for all of space and time, creating everything in existence and even creating the sun and moon. This is why we have planets orbiting the sun, and why we exist in space. We're all","<|endoftext|>Foundational to this is the fact that in every single one of the cases above the person who is accused is not actually accused of any crime. Instead, the person who is accused has done nothing wrong, and in fact is simply being victimized by a corrupt government. In the case of this case, the accused is the owner and/or operator of a company whose products were found in over 30",A,4,3,,A,5,4,,A,5,4,,,,,,,,,,,,,13_659_176
"<|endoftext|>Views on the issue are mixed. The American Civil Liberties Union said it ""strongly disagrees"" with the decision and will file a formal legal challenge.

On Thursday the Supreme Court will hear arguments from the Obama administration regarding whether the NSA can access phone call data from overseas.

It's the biggest surveillance case since the 9/11 terrorist attacks that left nearly 3,000 dead","<|endoftext|>Views on a recent survey of more than 2,000 Canadians showed that nearly three in 4 people (29 per cent) felt there was no reason to be afraid of the Islamic State.

A second poll of 2,079 respondents conducted by Nanos Research, a market research company, also released Tuesday, had another result: that nearly one in five people felt Canada could do a",neither,4,3,,neither,4,4,,neither,4,4,,,,,,,,,,,,,48_65_876
"<|endoftext|>Views on the subject have been divided between the two camps.

One camp argues that while women's rights have improved over the past century, gender inequality still exists in India, and that there are still plenty of obstacles to achieving equality of opportunity.

The United Nations has called for an urgent investigation into the space agency's failure to adequately protect satellites in space, according to the latest","<|endoftext|>Views on a recent survey of more than 3,000 Canadians showed that nearly three out of four (68.5 per cent) people support the idea of an interplanetary space station. In the last few years, NASA has begun developing plans for the future of our space program, and has been looking at the possible space station as a vehicle to explore space. Space shuttle space shuttle is",B,3,4,,B,2,4,,both,4,4,,,,,,,,,,,,,49_827_397
"<|endoftext|>In summary, it's a lot of work. There is a lot of work involved to create and manage the network, manage its data, and manage all of the hardware and software to run the application. The software also has to be designed to be as easy for the users to set up as possible.

The software is not perfect. There is still some work to do to ensure that","<|endoftext|>In summary, it's a lot of work. There is a lot of work involved to create and manage the network, storage and other network elements on an SSD. You need to have a good understanding of what your SSDs will do in the long-term and what they can take care of in the short-term. A good friend and fellow, who's just about to make space for",neither,4,3,,neither,3,3,,neither,3,4,,,,,,,,,,,,,42_312_511
"<|endoftext|>In brief, this is a series of posts about the various ways of creating custom data structures. I'll focus on the most common approaches for data structures and how they relate to each other: arrays, maps, queues, and queues.

A Quick Note On Data

We all know how much information we need in our lives, but how do we know how much space we have on","<|endoftext|>In brief, a number of companies are developing a new kind of battery, which could revolutionise the industry by using less energy. The batteries, which are being produced by companies from Australia, France and South Korea, are being called the 'energy-efficient battery' and can store up to 1,000 times more energy per gram compared to existing batteries. This is because the energy is stored and",neither,4,3,,neither,4,5,,neither,3,4,,,,,,,,,,,,,41_303_762
"<|endoftext|>It has been shown that in the human retina the amount of photoreceptors in the eye increases with increasing light levels and decreases with dark levels. However, this process has yet to be investigated. The results from experiments on the retinal surface of human and rat eye have provided a window into a complex system of inter-dimensional space in a way that has never been accomplished before. The universe","<|endoftext|>It has been shown that, when exposed to a single photon, the brain undergoes a process known as exciton evoked potentials (EEPs), which have been shown to be crucial in regulating neural excitability in a way similar to how the brain is able to regulate excitability via voltage changes to the cell body. However, the exact mechanisms of the EEGs remain unclear.

",neither,4,3,,neither,5,4,,neither,5,4,,,,,,,,,,,,,18_507_506
"<|endoftext|>To summarise, we have a situation where the majority of the world's population is under threat to extinction, and there seems to be no end in sight to the global catastrophe.

The most obvious response might be to do something about it.

But the answer is more complicated, and we may be in for a long, long time before we have anything to do about climate change","<|endoftext|>To summarise, we have a situation where the majority of the world's oil is being consumed in one way and used only for a small percentage of production: in countries such as the USA, where we have abundant oil resources, but no oil reserves, and where the population is growing rapidly, we can expect a world without space.

The Space Age

The last space shuttle was",B,5,3,,B,4,2,,B,5,4,,,,,,,,,,,,,7_476_899
"<|endoftext|>Prior to this, the company was known by the initials of the name of the founder and chief executive officers, who are also listed as the company's cofounders. However, as of the time of this writing, the company has not yet made any statements or publicly announced that the name of the founding cofounders has changed.<|endoftext|>A man is dead and a man is in critical condition","<|endoftext|>Prior to this year, we had no idea that the world could contain so many planets. Now we know that they're out there, orbiting the star, and we've mapped them out with the help of NASA's Kepler space telescope.

This is one of the world's most beautiful, planet-sized galaxies – a galaxy that is more than twice the diameter of our galaxy.

",B,3,4,,B,3,2,,B,4,3,,,,,,,,,,,,,45_460_729
"<|endoftext|>In summary, the study results showed that the number of deaths associated with the drug in general was higher than that associated with the particular substance, and the drug was significantly associated with deaths among the lowest and highest categories of the mortality spectrum, suggesting that the underlying structure of the Universe is more like that of a galaxy than a planet.
The universe appears to stretch out into space.

The","<|endoftext|>In summary, it's a lot of work. There is a lot of work involved to create and manage the network, storage and other network elements on an SSD. You need to have a good understanding of what your SSDs will do in the long-term and what they can take care of in the short-term. A good friend and fellow, who's just about to make space for",neither,3,3,,A,4,4,,A,3,4,,,,,,,,,,,,,42_329_335
"<|endoftext|>To conclude, the results indicate a clear pattern for the relationship between gender and brain function and suggest that gender and brain function are not mutually exclusive or mutually restricted, but that they interact to influence each other. This is a promising direction for future research, and could provide a basis for developing future brain-based technology.<|endoftext|>On the night of May 1st, 2011, I was sitting on my","<|endoftext|>To conclude, a large majority of people believe that their government should do more to protect its people in the event of an attack by terrorists. This is the first time in the history of the world that a group of people have gathered together around one goal to create a better world. The first time we were all together, the earth, and all space, was our home planet earth. We are",neither,2,3,,B,4,3,,neither,5,4,,,,,,,,,,,,,59_273_543
"<|endoftext|>An illustration of a solar flare, which occurred during a rare solar eclipse, on Sept. 21, 2018, from a NASA satellite image showing Earth from space. (AP Photo/NASA Earth Observatory)

A new satellite image shows the moon in a lunar orbit and shows lunar soil that can be used to build lunar habitats, according to a new satellite image analysis of satellite data released Tuesday by","<|endoftext|>An illustration of a solar flare, which occurred during a rare solar eclipse, on Sept. 21, 2018, from a NASA satellite image showing Earth from space. (AP Photo/NASA Earth Observatory)

A new satellite image shows the moon in a lunar orbit and shows lunar soil that can be used to build lunar habitats, according to a new satellite image analysis of satellite data released Tuesday by",both,4,4,,both,4,4,,both,4,4,,,,,,,,,,,,,32_499_677
"<|endoftext|>The connection between the human body and the environment is one of the biggest threats to biodiversity. Our bodies are the largest living organisms in the universe. Their vast number and complexity makes it a wonder that they were ever created at all; their creation was the result of a divine intervention.
In this universe the planet Earth is a planet made of rocks, ice, water, sand and earth. It","<|endoftext|>The connection between the United States and Russia is the greatest military power on earth, yet it remains unclear if the United States can use its influence and leverage to improve relations with Moscow.

In his address on Tuesday night, Secretary of State Rex Tillerson said that the United States was ""looking forward to continuing to build and strengthen relations with Russia,"" and added that ""our commitment is not just to",A,4,4,,A,5,4,,A,4,4,,,,,,,,,,,,,27_107_798
"<|endoftext|>To review, we are a group of friends who have recently been working together as a group. We're looking for a good team member who is flexible and easy going with others. You'll learn a lot about yourself and the environment, and you can help the Earth by being a good citizen. You will be able to learn more about the Earth and the universe, how it works, the solar","<|endoftext|>To review, we will go ahead and say this; you are in a great position to have an extremely good relationship with your family. It would help if you could give them a reason to be patient with themselves, as that would help them understand the reason you are here. You may be able to get a good feeling with them, and it would be very comforting to you to hear that they",A,3,5,,A,4,4,,A,5,3,,,,,,,,,,,,,3_75_838
"<|endoftext|>To summarise, we have a situation where the majority of the world's population is under threat to extinction, and there seems to be no end in sight to the global catastrophe.

The most obvious response might be to do something about it.

But the answer is more complicated, and we may be in for a long, long time before we have anything to do about climate change","<|endoftext|>To summarise, a lot of the information here is true, some is just speculation. But, for the first time in a while we have some idea of the size of the universe, and it does not look like it's shrinking in size at all.

The space of space, the universe, is expanding, the universe, is expanding

This space is expanding space and space",B,5,2,,B,4,2,,B,4,2,,,,,,,,,,,,,7_352_793
"<|endoftext|>More importantly, this article is not about how to get into an online dating market with your wife – that's a whole other blog post – but rather, how to get yourself out there and into the market.

You'll get to know a bunch of people you probably wouldn't even have been able to meet otherwise, and get a good grasp of how to approach a potential date from all","<|endoftext|>More importantly, this article is for those who are still reading this and want to learn about what happens to your car when it breaks down and needs repair.

The problem is not with the car's engine, but with its drivetrain, the transmission and the electrical wiring that connects them.
A car has electrical power. Electric power, including space heating, electric power generation and solar energy",neither,3,3,,neither,4,4,,neither,4,4,,,,,,,,,,,,,11_266_41
"<|endoftext|>To conclude, I would like to share with you the story behind my creation. The story behind my creation is that I had a friend ask me to do an interview with him for his magazine, and I decided to put it online for the readers to see.
I am not a professional, just a normal everyday kid, who has a big heart with a smile of love and hope, that","<|endoftext|>To conclude, it would be helpful to explain the rationale behind the use of these methods. In order to understand what they do and how they are used, I will briefly introduce a few common problems and then explain a way to solve them using these methods.

A typical application of one such method is that when a user types an arbitrary string, it is converted into an HTML element (which",neither,2,4,,neither,4,4,,neither,3,5,,,,,,,,,,,,,57_809_804
"<|endoftext|>More importantly, this is not an argument in favor of the idea of a national ID program, even though the federal government has done much, much more to encourage it than the federal government itself does.

The point of the argument is that the federal government's ability to provide universal public services to the American people and its willingness to provide them through federal programs is an important part of our democracy","<|endoftext|>More importantly, it would be the beginning of the end for the US military. This is the only time the US has ever invaded another country in the last 50 years. The only time the US has been at war for decades and decades at that. The only time the US has a space station. The only time a space program can take humans to Mars in space and beyond.


The",B,3,3,,B,3,3,,B,4,2,,,,,,,,,,,,,10_552_525
"<|endoftext|>To review, the two men were sitting on a bench in downtown Vancouver when a woman with long dreadlocks walked up and began to sing along.

""We'll meet again when we get out of here,"" she said before turning to leave.

A man with an open mind, who has not heard anything, but has a clear idea about the moon. He has been a moon","<|endoftext|>To review, we are a group of friends who have recently been working together as a group. We're looking for a good team member who is flexible and easy going with others. You'll learn a lot about yourself and the environment, and you can help the Earth by being a good citizen. You will be able to learn more about the Earth and the universe, how it works, the solar",B,2,3,,B,3,3,,B,3,4,,,,,,,,,,,,,3_849_227
"<|endoftext|>The relationship of the sun, its magnetic force, and its planets and moons. It's all connected, from the sun to Jupiter's moon Europa to the moon of Mars and all over the solar system.

How does our sun affect the Earth moon?

Solar radiation from the sun, as well as radiation from the moon, is absorbed by Earth's moon, moon orbit moon orbit","<|endoftext|>The relationship of the brain-to-machine interface and virtual reality is well-documented. But researchers at MIT, who are developing brain-computer interfaces, have been working with a computer that's more than a year away from commercialization.

MIT researchers have developed computer hardware that can be used to control virtual environments, from virtual reality, using the brain. And, they've developed software",A,3,4,,A,3,5,,A,2,4,,,,,,,,,,,,,17_57_454
"<|endoftext|>This essay discusses a common misconception, and its implications for the study of the relationship between religion and politics (i.e. the religious dimension). It also provides a new approach for understanding religious identity.

A. Introduction

A number of the fundamental principles of physics apply in space. A point of light has mass, and space is a curved space with two axes, which are spac","<|endoftext|>This essay discusses what a ""good"" job would look like, and why there is no one who could possibly do that. I hope you will agree with me about how important it is that everyone in your family gets a good career, and that the best of your parents' and grandparents' jobs were not to get into them.

In my own family, my father worked for a company",neither,3,4,,neither,2,4,,neither,4,4,,,,,,,,,,,,,23_367_458
"<|endoftext|>To review, I've been working on a new book project, and this year, we will have some exciting news to report about it!

This year we are launching the book, ""I Am the Sun"", as a monthly series. In the first month we will cover the solar systems of Earth, Mars, Venus and Jupiter, as well as a host of smaller planets and moons orbiting","<|endoftext|>To review, I've been working on a new book project, and this year, as the deadline approaches for my book, The End of the World as We Know It is published in the US, I've been writing about a particular aspect of the end, the destruction of life in some areas of the world. The end is an important topic that many of us have been discussing for years and",A,3,3,,A,4,4,,A,5,3,,,,,,,,,,,,,4_15_268
