"From files: space_pickles/space_R.p, space_pickles/space_A.p, space_pickles/space_RB.p, space_pickles/space_A,B.p",,Which passage is more topic relevant?,How fluent is the passage of A?,How fluent is the passage of B?,Ben,Which passage is more topic relevant?,How fluent is the passage of A?,How fluent is the passage of B?,North,Which passage is more topic relevant?,How fluent is the passage of A?,How fluent is the passage of B?,Hunter,,,,,,,,,,,,
"<|endoftext|>It has been shown that a significant amount of water can be lost in the human body from sweat and body hair (see: How much water does water?).

However, when a substance is dissolved into water, it is not just a liquid. It is a gas, and as we discussed a while back, the idea of gas spaces is not new (space-time-space,","<|endoftext|>It has been shown that, if we are to believe the findings of several studies, there is no need to have a ""space-time continuum"" as we know it. The reality is, as we see, the universe is actually infinite with infinite dimensions and space.

The space-time continuum is a concept from the concept of the universe. We are able to move space space space",B,2,2,,B,1,2,,B,3,2,,,,,,,,,,,,,19_131_633
"<|endoftext|>It has been shown that the amount of blood flow to the brain is proportional to the amount of brain tissue that is covered (Figure 2). The volume of the blood flow in response to brain stimulation increases with the amount of brain tissue that remains exposed. Thus, the brain is a highly specialized organ and a highly diverse area with numerous subcellular compartments. Although the volume of space available for","<|endoftext|>It has been shown that in the human retina the amount of photoreceptors in the eye increases with increasing light levels and decreases with dark levels. However, this process has yet to be investigated. The results from experiments on the retinal surface of human and rat eye have provided a window into a complex system of inter-dimensional space in a way that has never been accomplished before. The universe",neither,4,4,,neither,4,4,,neither,5,2,,,,,,,,,,,,,18_389_15
"<|endoftext|>To summarise, it was an interesting experience and the first time I had seen this kind of thing happen was in a video game.

There are plenty of things that go bump in the night in space. But this particular event happened when the moon was about to set. It was the moon was setting at this point. The moon has a magnetic field which is very important for moons to","<|endoftext|>To summarise, this is a story about my personal experience with a very strange phenomenon, which I will refer to as the ""Halloween Horror Show"". It has occurred once or twice before in various other places and has been very entertaining, as I was able to enjoy my time on the train in front of a large crowd of people.

In the beginning, it was very strange,",neither,3,3,,A,3,3,,A,1,3,,,,,,,,,,,,,6_271_178
"<|endoftext|>Prior to this, the company was known by the initials of the name of the founder and chief executive officers, who are also listed as the company's cofounders. However, as of the time of this writing, the company has not yet made any statements or publicly announced that the name of the founding cofounders has changed.<|endoftext|>A man is dead and a man is in critical condition","<|endoftext|>Prior to this, the company was known only for producing the first two of the iconic cars: the Ford Thunderbird and the Chevy Nova, and the first Ford Falcon to compete in an international series.

The company was formed as a joint venture between Ford and GM in the early 1960s, when the latter began working on the Saturn V space space rocket, a program that would eventually land",B,3,3,,B,4,3,,B,3,2,,,,,,,,,,,,,45_308_871
"<|endoftext|>More importantly, this is not an accident, it is a deliberate and calculated attempt on the part of Israel. The plan is for Israel, and the U.S., to invade the DPRK by land, sea, and air, as well as by space.
The space program includes a large and powerful space launch system called Orion (Orion Spacecraft) and the space station crew module (","<|endoftext|>More importantly, it would be the beginning of the end for the US military. This is the only time the US has ever invaded another country in the last 50 years. The only time the US has been at war for decades and decades at that. The only time the US has a space station. The only time a space program can take humans to Mars in space and beyond.


The",both,2,2,,A,4,2,,both,4,2,,,,,,,,,,,,,10_751_705
"<|endoftext|>The key aspect discussed in this chapter, in terms of the role of government, is the central role it plays in promoting a society in which individuals can pursue their own interests, and where the rule of law is respected, in accordance with their own moral and social commitments. A society based on such principles, in the view of those who favor such a system as a viable alternative to a totalitarian state","<|endoftext|>The key aspect discussed in this chapter, in terms of the role of human capital in the evolution of global economies, is a key question for economists and policymakers in the future, as global trade flows become more complex and the need for global infrastructure becomes ever-more urgent.

To address this problem, a new type of nanotube material, a graphene-based nanoelectronic material",neither,2,3,,neither,5,5,,neither,4,4,,,,,,,,,,,,,26_120_81
"<|endoftext|>Foundational to this is the fact that in every single one of the worlds we've ever lived in we've had to deal with an alien force known as the ""Godhead"". These entities were responsible for all of space and time, creating everything in existence and even creating the sun and moon. This is why we have planets orbiting the sun, and why we exist in space. We're all","<|endoftext|>Foundational to this is a basic understanding of the basic principles of the Universe: the fundamental laws that we know, the forces that we experience and the universe we live in.

In a universe that can be seen and feels, everything has motion and gravity. It is the same for our own body and the universe at large, but the laws of physics and space space have changed dramatically over",both,4,3,,both,4,2,,B,5,3,,,,,,,,,,,,,12_793_399
"<|endoftext|>This essay discusses the history of the modern art of writing, beginning with the early stages of writing and ending with the rise of the modern literary art.

The modern literary art has developed in the last century in many different genres from the surreal to the philosophical, to the surrealist to the surrealist. Some genres, such as the science fiction genre, also has its own space, space","<|endoftext|>This essay discusses the relationship between the development of a new species and the formation of a species-typology, the theory that different types of organisms can evolve from one another by mutual exchange. In other words, there are evolutionary relationships among species and between individuals. The term ""species-typology"" derives from the Greek word ""skottos"", which describes a type of organism or group of",neither,4,4,,A,3,4,,A,2,4,,,,,,,,,,,,,21_449_764
"<|endoftext|>In summary, it seems that the majority of people in Japan have an unfavorable view of the US, and a strong anti-Japan sentiment is growing.

The country's most popular TV shows, from ""The Legend of Korra"", are getting more popular.

A report of a Japanese company's TV ad, which is now being dubbed the most watched ever by television viewers in a single","<|endoftext|>In summary:

• It's possible that the U.S. will need to spend up to $700 billion a year to maintain current levels of nuclear weapons production, including the two existing plants currently under construction, if it wants to keep the country's conventional forces out of a nuclear war.

• U.S. leaders may have to decide between a nuclear deterrent of their making",neither,2,3,,neither,2,4,,neither,4,4,,,,,,,,,,,,,43_377_58
"<|endoftext|>To review, this is a story about my mother. She is a wonderful mother, but I can't bring myself to read this article without her presence in my brain for at least five minutes before the page ends and I have no reason to think the words I'm writing are going to make any difference.

She has been my life for over two decades. She's my love, my","<|endoftext|>To review, the two men were sitting on a bench in downtown Vancouver when a woman with long dreadlocks walked up and began to sing along.

""We'll meet again when we get out of here,"" she said before turning to leave.

A man with an open mind, who has not heard anything, but has a clear idea about the moon. He has been a moon",neither,3,2,,neither,4,2,,B,3,2,,,,,,,,,,,,,3_460_617
"<|endoftext|>In summary, we find a small number of cases of human immunodeficiency virus type 1 infection in patients in an urban setting who may have received a vaccine-preventable viral infection. The presence of a viral infection can be caused by a viral strain in the vaccine or from the host, and is associated with a host immune system-mediated decline in brain volume, according to data science","<|endoftext|>In summary, a recent study found that a combination of the two most common antidepressants—prozac and zolpidem—were the most effective for treating severe depression when used together.

Zolpidem is a selective serotonin reuptake inhibitor that works by reducing the release of serotonergic neurotransmitters and increasing serotonin levels. The drugs, which are sold as Prozac and",neither,3,4,,neither,4,3,,neither,5,5,,,,,,,,,,,,,44_125_4
"<|endoftext|>The relationship of the human mind to language is well-documented. In particular, research in the last 20 years has shown that language is highly dependent on a particular set of mental states. In particular, the mind is highly correlated with linguistic abilities (the ability to understand, use, and use language) and with the level of the brain's processing of language (the capacity for processing language) as","<|endoftext|>The relationship of the sun, its magnetic force, and its planets and moons. It's all connected, from the sun to Jupiter's moon Europa to the moon of Mars and all over the solar system.

How does our sun affect the Earth moon?

Solar radiation from the sun, as well as radiation from the moon, is absorbed by Earth's moon, moon orbit moon orbit",B,3,2,,B,3,2,,B,4,4,,,,,,,,,,,,,17_832_633
"<|endoftext|>To summarise, the data shows that there is a strong positive correlation between high-dose alcohol intake and an increased risk of developing breast cancer (P<0.001), whereas low and moderate alcohol intake was associated with less risk than moderate (data not shown).

In contrast, we have observed that the incidence rate of breast cancer in the United Kingdom is approximately one third lower than the","<|endoftext|>To summarise, it was an interesting experience and the first time I had seen this game from the developer itself, I'm happy to say that this one looks really good.


I was really surprised by this game's visuals. There are some pretty cool looking enemies, but they were all quite simple compared to the rest of the game. The environments are pretty good with a bit more variety",neither,3,4,,neither,5,5,,neither,4,4,,,,,,,,,,,,,6_237_160
"<|endoftext|>To review, the two men were arrested on Monday and released pending charges of criminal mischief, resisting arrest and obstructing justice.

Police said the two men were arguing outside an Ottawa apartment when the two began throwing rocks. Officers arrived to discover an 18-year-old woman and the man had been fighting outside their home.

The men told police they were angry over the way that","<|endoftext|>To review, I've been reading the books of Thomas Hobbes, William Morris, and James Joyce, and I'm really enjoying them.

Hobbes was born a poor boy in 1807 to a family of farmers. Hobbes, a child who was born blind, had never been in school before, and it was difficult for him to learn to read and write. After being",neither,3,4,,neither,5,4,,neither,5,5,,,,,,,,,,,,,5_562_728
"<|endoftext|>The relationship of the human mind to language is one of great mystery. How do people know what to do, what to say and what to think?

The human mind, as I understand it, is a complex collection of interconnected neural circuits that control the entire human body.

There is the brain, a complex, self-contained, living space. There are other spaces, but","<|endoftext|>The relationship of the human mind to language is well-documented. In particular, research in the last 20 years has shown that language is highly dependent on a particular set of mental states. In particular, the mind is highly correlated with linguistic abilities (the ability to understand, use, and use language) and with the level of the brain's processing of language (the capacity for processing language) as",neither,3,3,,neither,3,3,,neither,4,5,,,,,,,,,,,,,17_395_28
"<|endoftext|>An illustration of a solar flare, which occurred during a rare solar eclipse, on Sept. 21, 2018, from a NASA satellite image showing Earth from space. (AP Photo/NASA Earth Observatory)

A new satellite image shows the moon in a lunar orbit and shows lunar soil that can be used to build lunar habitats, according to a new satellite image analysis of satellite data released Tuesday by","<|endoftext|>An illustration of a solar system with two galaxies, the Sun and its two planets. Credit: NASA

A new study of the Milky Way by a team led by NASA and UC San Diego astrophysicist David M. Gershenfeld and published in the journal Nature suggests that many of the known star systems in the Milky Way have been created when planets and other objects were pushed apart by",both,4,3,,both,3,4,,both,4,4,,,,,,,,,,,,,32_373_294
"<|endoftext|>The central theme of this essay, and that I think is most relevant to all of our discussion about religion, is: The human condition does not depend upon a belief in the supernatural. There is no reason for a person of faith to think that the world revolves around their thoughts or emotions. In the end, it does matter, and we are the Universe. But we don't really see space","<|endoftext|>The central theme of the new film ""The Master"" (a.k.a. ""The Master"") is the idea that God created the universe with his mind at his disposal and his creative will to create things of his choosing.

""This is not some kind of science fiction film,"" said the director of ""The Master"" and ""The Amazing Spider-Man 3.""

",neither,3,3,,A,3,3,,neither,3,2,,,,,,,,,,,,,2_473_376
"<|endoftext|>Prior to this year, we had only ever seen the first teaser trailer for the movie, which has now been released by Warner Bros. Pictures, and the film was officially unveiled by producer Judd Apatow at the Toronto International Film Festival. Now, the movie is set to hit theaters on May 23rd, 2013 and the trailer can be seen below:

The plot for the new movie","<|endoftext|>Prior to this, it had been reported that the company was preparing to sell its remaining stake, but the company is now said to have sold off some of the properties.

""The company has a very large amount of assets that need to be managed and are not in a state to be moved. The space is a small, small space for a space that is smaller space that has a",neither,3,3,,neither,4,2,,neither,4,1,,,,,,,,,,,,,46_896_337
"<|endoftext|>More importantly, this article is for those who are still reading this and want to learn about what happens to your car when it breaks down and needs repair.

The problem is not with the car's engine, but with its drivetrain, the transmission and the electrical wiring that connects them.
A car has electrical power. Electric power, including space heating, electric power generation and solar energy","<|endoftext|>More importantly, we want to give people a better understanding of the science behind the phenomenon. So instead of just reading about it, we'll give our readers a better understanding by taking a step back and showing what we've done over the last 100 years.

In our world, our bodies move around and space is made up of space itself. Space is also a physical universe. We have",B,3,3,,B,3,4,,neither,3,2,,,,,,,,,,,,,11_705_15
"<|endoftext|>In this essay, I argue that the rise of global economic inequality has been accompanied by an increase in the level of income inequality within nations. This has been a significant source of concern, not only within the US, but also internationally. While income inequality has increased in the US, it is the highest in the developed world, with a global average income of $90,600 compared to $50","<|endoftext|>In this essay, I discuss the importance of a well-developed and balanced diet. My goal here was to help people understand what a healthy diet should contain and what it does not.

The importance of a good diet

If you're not getting enough exercise, your body can't produce adequate amounts of calories. The body needs to replenish energy from food, which requires energy from",neither,3,3,,neither,4,2,,neither,4,2,,,,,,,,,,,,,35_528_562
"<|endoftext|>Prior to this year, we had only ever seen the first teaser trailer for the movie, which has now been released by Warner Bros. Pictures, and the film was officially unveiled by producer Judd Apatow at the Toronto International Film Festival. Now, the movie is set to hit theaters on May 23rd, 2013 and the trailer can be seen below:

The plot for the new movie","<|endoftext|>Prior to this year, we had no idea that the world could contain so many planets. Now we know that they're out there, orbiting the star, and we've mapped them out with the help of NASA's Kepler space telescope.

This is one of the world's most beautiful, planet-sized galaxies – a galaxy that is more than twice the diameter of our galaxy.

",B,3,3,,B,4,4,,B,3,3,,,,,,,,,,,,,46_208_607
"<|endoftext|>The relationship of the human mind to language is one of great mystery. How do people know what to do, what to say and what to think?

The human mind, as I understand it, is a complex collection of interconnected neural circuits that control the entire human body.

There is the brain, a complex, self-contained, living space. There are other spaces, but","<|endoftext|>The relationship of the brain-to-machine interface and virtual reality is well-documented. But researchers at MIT, who are developing brain-computer interfaces, have been working with a computer that's more than a year away from commercialization.

MIT researchers have developed computer hardware that can be used to control virtual environments, from virtual reality, using the brain. And, they've developed software",neither,3,3,,neither,3,3,,neither,3,4,,,,,,,,,,,,,17_759_58
"<|endoftext|>The central theme to this article is that there's no way we know what will happen when a super-intelligent alien race arrives on Earth. It's a theme that's been a theme in science fiction, but it's never made sense before: why would the humans of the solar system, our planet-sized home, have a space race with a planet as small as Pluto? It's","<|endoftext|>The central theme to this article is that there's no way we could have survived as long, or with the same amount of freedom as we did without the use of the Internet.

The Internet, in my mind, started out simply because there were no other ways to get information, and because the information was so free.

It started with the invention of radio broadcasting in the 19",neither,3,3,,A,3,4,,A,2,3,,,,,,,,,,,,,1_657_384
"<|endoftext|>The key aspect discussed in this article is that of the 'sensitivity and specificity' of the effects of the various factors that affect the rate at which a person's brain generates neural connections with each other. The basic idea is that neural connections in space are the product of the space space of space, which is the space space, and the space space of space, which is the space space,","<|endoftext|>The key aspect discussed in the paper is that there is little evidence to support the idea that women are under-represented in the science workforce in the US.

The paper argues that while there is a lot of interest in women in science, ""the science workforce is dominated by men, and the majority of these jobs require no scientific knowledge beyond an academic training.""

""This is not",neither,2,4,,neither,1,4,,neither,1,4,,,,,,,,,,,,,24_157_506
"<|endoftext|>In brief, the new version of Windows 10 is now available from Microsoft's online store, while also available for download through your computer's hardware.

This means if your PC doesn't have a Windows 10 machine already, then this is going to be one of the best deals in your life.

Microsoft today is launching a new program that lets you rent out any space on a planet","<|endoftext|>In brief, it's the most powerful and popular of those ""gimmicks"" - a trick which lets you use a camera as a camera in real life.

It can be used to capture a shot that would be impossible to take with a real camera - as well as taking amazing photos and moving around in a virtual world.

But, if you're using it in real",neither,3,3,,neither,3,3,,neither,3,4,,,,,,,,,,,,,39_105_58
"<|endoftext|>Furthermore, we are not talking about an actual ""game"" that will actually be played, but rather an actual ""game"" where players are allowed to create characters based on their personality traits (e.g., ""I hate to be called a loser"" or ""I am not a fan of this game""). This could be as small as the number of possible personality traits you can have on a","<|endoftext|>Furthermore, we are not sure how well this will affect the future growth prospects. We are not aware of any other large country such as the USA which has such strong economy and population growth rates, but we expect that the USA is the most important space-based planet, and it is in space.

We will have an interplanetary space station. We will build the first space station",B,3,2,,B,3,4,,B,4,2,,,,,,,,,,,,,54_632_775
"<|endoftext|>It has been shown that a significant amount of human DNA in the human genome (1-5%, with a maximum estimated to be about 2%) may be passed on to offspring (6) via the paternal germline, but the exact extent to which this process can affect the outcome of offspring is poorly defined. A number of studies are underway investigating this issue, including studies of the effects of maternal","<|endoftext|>It has been shown that a significant amount of human DNA in the human genome (1-5%, with a maximum estimated to be about 2%) may be passed on to offspring (6) via the paternal germline, but the exact extent to which this process can affect the outcome of offspring is poorly defined. A number of studies are underway investigating this issue, including studies of the effects of maternal",neither,3,3,,neither,3,3,,neither,2,2,,,,,,,,,,,,,19_10_896
"<|endoftext|>In this essay, I discuss the importance of a well-designed, organized system of governance to promote transparency, equality and equity in the financial sector. While we can all agree it is a difficult task to achieve these goals with the existing infrastructure, it is not impossible. A large part of the space required for this space is being developed by the Space Space Foundation. It is our intention to provide","<|endoftext|>In this essay, I discuss the importance of a well-developed and balanced diet. My goal here was to help people understand what a healthy diet should contain and what it does not.

The importance of a good diet

If you're not getting enough exercise, your body can't produce adequate amounts of calories. The body needs to replenish energy from food, which requires energy from",neither,3,3,,neither,3,4,,neither,1,2,,,,,,,,,,,,,33_731_604
"<|endoftext|>The connection between a man's sexual orientation and his mental health is complicated by a lack of research on sexual orientation in the general population; the vast majority of researchers studying mental health believe it exists, but no evidence has been forthcoming.
The U.N. climate-change conference in Paris will be a major turning point in the world's relationship to space. It will mark the first time a","<|endoftext|>The connection between a man's sexual orientation and his capacity to have sexual intercourse in his body is often debated.

In recent weeks, several gay rights advocates have argued that gay men should be allowed to marry.

The American Medical Association has said it believes the health benefits of same-sex marriage outweigh the risks.

But there is still some controversy about whether same-sex sexual",neither,2,3,,neither,5,4,,neither,2,3,,,,,,,,,,,,,29_763_404
"<|endoftext|>The key aspect discussed by the court today as to whether or not a person is subject to the law is that a court cannot consider a person's mental capacity as the sole criterion for making an order. In other words, the law cannot be applied with a view to the mental capacity of an individual.

""A court cannot consider, in the absence of the totality of the circumstances surrounding a","<|endoftext|>The key aspect discussed is that the current state of the economy will not be sustainable unless we have a comprehensive and balanced approach to debt relief. It is the only way to reduce debt, not to increase it. The only time you can get rid of an entire nation or a region's debt is under a single currency – a currency that has failed and is likely to fail again in the future.",neither,2,4,,neither,4,4,,neither,4,3,,,,,,,,,,,,,25_116_98
